1; RAISEN;Three, three bodies in the whole facility. This smells more than weird, 
and it's not just the corpse, everything else, the walls, the floor, the columns, 
those bugs have been in here for a long time.;  ;<end>
2; Me;...; ;<end>
3; RAISEN;This one here is not wearing any identifying pin, but he is wearing the 
same type of clothing; a scientist.;  ;<end>
4; Me;...; ;<end>
5; RAISEN;There is a document in his inside pocket, completely torn and stained 
with blood. But you can read the name of the project. Empress.;  ;<end>
6; Me;...; ;<end>